{
  "id": "2023-star-wars-094",
  "year": 2023,
  "collection": "Star Wars",
  "number": "94",
  "title": "C-3PO",
  "franchise": "Star Wars: A New Hope",
  "description": "Protocol Droid C-3PO was on the Tantive IV as the ship was fleeing Darth Vader. He and R2-D2 escaped to Tatooine. Taken by Jawas, the pair came into the possession of Luke Skywalker. The plans hidden on R2-D2 led the trio to Obi-Wan Kenobi and eventually, the Death Star. C-3PO was concerned over damage that R2-D2 took in the Battle of Yavin.",
  "species": "Droid",
  "home_world": "Tatooine",
  "affiliation": [
    "Rebel Alliance"
  ]
}
