{
  "id": "2023-star-wars-035",
  "year": 2023,
  "collection": "Star Wars",
  "number": "35",
  "title": "Brasso",
  "franchise": "Andor",
  "description": "Brasso was a friend of the Andor family. He made his living as a Grappler. When Pro-Mar Enforcement searched for Cassian Andor, Brasso interfered. He also fought against the Imperial Forces in the riot that was triggered by Maarva's holographic speech at her funeral. He later escaped the planet with Bix Caleen and others.",
  "species": "Human",
  "home_world": "Ferrix",
  "affiliation": [
    "Salvager"
  ]
}
