{
  "id": "2015-the-force-awakens-series-1-083",
  "year": 2015,
  "collection": "The Force Awakens Series 1",
  "number": "83",
  "title": "Rey Refuses Unkar",
  "description": "Unkar Plutt offers Rey a very large sum of food for the Droid. But Rey can't bring herself to sell him, upsetting Unkar. But Rey and BB-8 walk away, back through the market."
}
