{
  "id": "2021-the-mandalorian-season-1-and-2-european-edition-140",
  "year": 2021,
  "collection": "The Mandalorian Season 1 and 2 European Edition",
  "number": "140",
  "title": "Enter the Dark Troopers",
  "description": "Back up on the Imperial Cruiser, Moff Gideon dispatches the Dark Trooper. The fearsome Droids fly down to the planet's surface surrounding the seeing stone and the sleeping Child."
}
