{
  "id": "1994-galaxy-series-2-186",
  "year": 1994,
  "collection": "Galaxy Series 2",
  "number": "186",
  "title": "The Star Wars Holiday",
  "section": "Film Production and Poster Art",
  "description": "The Star Wars Holiday special was seen once at Thanksgiving in 1978. It seemed too Hollywood, too off the mark in tone and content. But bounty hunter Boba Fett was first introduced, and there was an extended visit with Chewbacca's family. In one concept for the show, Chewie and his son Lumpy try out a virtual reality ride, seen here in sketches by Joe Johnston."
}
