{
  "id": "2023-chrome-091",
  "year": 2023,
  "collection": "Chrome",
  "number": "91",
  "title": "Cad Bane",
  "description": "The notorious bounty hunter and gunslinger Cad Bane entered the increasingly dangerous environment of Tatooine on the side of the Pyke Syndicate. He gunned down Freetown marshal Cobb Vanth and his deputy, and warned Boba Fett to clear out. When Bane and Fett faced off again, Bane revealed that he was responsible for the deaths of Fett's Tusken friends. Fett used his gaderffii stick to defeat Bane.",
  "affiliation": ["Independent"]
}
