{
  "id": "2016-chrome-the-force-awakens-076",
  "year": 2016,
  "collection": "Chrome The Force Awakens",
  "number": "76",
  "title": "Doctor Kalonia Examines Chewbacca",
  "description": "At the Resistance base, Doctor Kalonia tends to Chewbacca's wounds. He regales her with the details of the battle on Takodana. She assures him that he must be very brave."
}
