{
  "id": "2021-the-mandalorian-season-1-and-2-european-edition-043",
  "year": 2021,
  "collection": "The Mandalorian Season 1 and 2 European Edition",
  "number": "43",
  "title": "Looking for Work",
  "description": "Luckily for The Mandalorian, another bounty hunter is in the Cantina, and he needs a partner to bring in some particularly deadly prey."
}
