{
  "id": "2020-the-rise-of-skywalker-series-2-040",
  "year": 2020,
  "collection": "The Rise of Skywalker Series 2",
  "number": "40",
  "title": "Duel through the Force",
  "description": "The duel between Rey and Kylo Ren begins, taking their connection to the next level. Rey is still secretly in Kylo Ren´s quarters, and Ren is on the surface of Kijimi, looking for her. Ren goads her to come and face him, all while they dance around fighting with words as much as lightsabers."
}
