{
  "id": "2024-chrome-107",
  "year": 2024,
  "collection": "Chrome",
  "number": "107",
  "title": "Chewbacca",
  "subtitle": "The Resistance",
  "franchise": "Star Wars: The Force Awakens",
  "description": "When his friend, Han Solo, lost his son, Ben, and their home in the Millennium Falcon, Chewbacca the Wookiee joined back up with him to smuggle illicit goods across the stars once more. When the Resistance came calling, though, Chewbacca joined back up and helped take down Starkiller Base, even though it would cost him the life of his best friend."
}
